{
  "source": "clashcontrol", "action": "set_clash_status",
  "projectKey": "demo", "targetKeys": { "ifcGuid": "IFCGUID-SAMPLE-A", "sourceLocalId": "clash-114" },
  "actor": "human:u_8f3a", "approvedBy": "human:u_8f3a",
  "result": "executed", "after": { "status": "expected", "ruleId": "R2" },
  "prevHash": "9f2c…", "ts": "2026-06-15T10:00:00Z"
}
